{
  "$schema": "https://json-schema.org/draft/2020-12/schema",
  "$id": "https://schemas.jlaudio.local/jl-mixing/v1.1/project-manifest.schema.json",
  "title": "JL Mixing Project Manifest v1.1",
  "type": "object",
  "required": [
    "metadata",
    "project_id",
    "project_name",
    "client",
    "artist",
    "album",
    "producer",
    "mix_engineer",
    "music",
    "audio",
    "delivery",
    "schedule",
    "creative_direction",
    "state",
    "revisions"
  ],
  "properties": {
    "metadata": {
      "type": "object",
      "required": [
        "schema",
        "schema_version",
        "document_id",
        "created_with",
        "created_at",
        "last_modified_at"
      ],
      "properties": {
        "schema": {
          "const": "mixing-project"
        },
        "schema_version": {
          "const": "1.1.0"
        },
        "document_id": {
          "type": "string",
          "format": "uuid"
        },
        "created_with": {
          "type": "string",
          "pattern": "^jl-mixing [0-9]+\\.[0-9]+\\.[0-9]+$"
        },
        "created_at": {
          "type": "string",
          "format": "date-time"
        },
        "last_modified_at": {
          "type": "string",
          "format": "date-time"
        }
      },
      "additionalProperties": false
    },
    "project_id": {
      "type": "string",
      "pattern": "^[a-z0-9]+(?:-[a-z0-9]+)*$"
    },
    "project_name": {
      "type": "string",
      "pattern": "\\S"
    },
    "client": {
      "type": "object",
      "required": [
        "client_document_id",
        "client_id"
      ],
      "properties": {
        "client_document_id": {
          "type": "string",
          "format": "uuid"
        },
        "client_id": {
          "type": "string",
          "pattern": "^[a-z0-9]+(?:-[a-z0-9]+)*$"
        }
      },
      "additionalProperties": false
    },
    "artist": {
      "type": "string",
      "pattern": "\\S"
    },
    "album": {
      "type": "string"
    },
    "producer": {
      "type": "string"
    },
    "mix_engineer": {
      "type": "string"
    },
    "music": {
      "type": "object",
      "required": [
        "bpm",
        "key",
        "time_signature"
      ],
      "properties": {
        "bpm": {
          "oneOf": [
            {
              "type": "null"
            },
            {
              "type": "number",
              "exclusiveMinimum": 0
            }
          ]
        },
        "key": {
          "type": "string"
        },
        "time_signature": {
          "type": "string"
        }
      },
      "additionalProperties": false
    },
    "audio": {
      "type": "object",
      "required": [
        "sample_rate",
        "bit_depth",
        "file_format"
      ],
      "properties": {
        "sample_rate": {
          "type": "integer",
          "enum": [
            44100,
            48000,
            88200,
            96000,
            176400,
            192000
          ]
        },
        "bit_depth": {
          "type": "integer",
          "enum": [
            16,
            24,
            32
          ]
        },
        "file_format": {
          "type": "string",
          "enum": [
            "WAV",
            "AIFF"
          ]
        }
      },
      "additionalProperties": false
    },
    "delivery": {
      "type": "object",
      "required": [
        "method",
        "requested_deliverables"
      ],
      "properties": {
        "method": {
          "type": "string",
          "pattern": "\\S"
        },
        "requested_deliverables": {
          "type": "array",
          "minItems": 1,
          "uniqueItems": true,
          "items": {
            "type": "string",
            "enum": [
              "main_mix",
              "instrumental",
              "acapella",
              "tv_mix",
              "performance_mix",
              "stems",
              "master"
            ]
          }
        }
      },
      "additionalProperties": false
    },
    "schedule": {
      "type": "object",
      "required": [
        "deadline"
      ],
      "properties": {
        "deadline": {
          "oneOf": [
            {
              "type": "null"
            },
            {
              "type": "string",
              "format": "date"
            }
          ]
        }
      },
      "additionalProperties": false
    },
    "creative_direction": {
      "type": "string"
    },
    "state": {
      "type": "object",
      "required": [
        "current_revision",
        "approved_revision",
        "delivered_revision"
      ],
      "properties": {
        "current_revision": {
          "type": "integer",
          "minimum": 0
        },
        "approved_revision": {
          "oneOf": [
            {
              "type": "null"
            },
            {
              "type": "integer",
              "minimum": 1
            }
          ]
        },
        "delivered_revision": {
          "oneOf": [
            {
              "type": "null"
            },
            {
              "type": "integer",
              "minimum": 1
            }
          ]
        }
      },
      "additionalProperties": false
    },
    "revisions": {
      "type": "array",
      "items": {
        "type": "object",
        "required": [
          "number",
          "revision_id",
          "created_at",
          "description",
          "approval"
        ],
        "properties": {
          "number": {
            "type": "integer",
            "minimum": 1
          },
          "revision_id": {
            "type": "string",
            "format": "uuid"
          },
          "created_at": {
            "type": "string",
            "format": "date-time"
          },
          "description": {
            "type": "string",
            "pattern": "\\S"
          },
          "approval": {
            "oneOf": [
              {
                "type": "object",
                "required": [
                  "approved_at",
                  "approved_by"
                ],
                "properties": {
                  "approved_at": {
                    "type": "null"
                  },
                  "approved_by": {
                    "type": "null"
                  }
                },
                "additionalProperties": false
              },
              {
                "type": "object",
                "required": [
                  "approved_at",
                  "approved_by"
                ],
                "properties": {
                  "approved_at": {
                    "type": "string",
                    "format": "date-time"
                  },
                  "approved_by": {
                    "type": "string",
                    "pattern": "\\S"
                  }
                },
                "additionalProperties": false
              }
            ]
          }
        },
        "additionalProperties": false
      }
    }
  },
  "additionalProperties": false
}

